{
  "$schema": "https://json-schema.org/draft/2020-12/schema",
  "$id": "contract-agentops/approval-result",
  "title": "ApprovalResult",
  "type": "object",
  "additionalProperties": false,
  "required": ["decision", "confidence", "reasoning", "conditions", "escalation_required", "next_actions"],
  "properties": {
    "decision": { "type": "string", "enum": ["APPROVE", "REJECT", "CONDITIONAL", "approve", "reject", "conditional"] },
    "confidence": { "type": "number", "minimum": 0, "maximum": 1 },
    "reasoning": { "type": "string" },
    "conditions": { "type": "array", "items": { "type": "string" } },
    "escalation_required": { "type": "boolean" },
    "next_actions": { "type": "array", "items": { "type": "string" } }
  }
}